"Title","First author","Last author","Abstract","Journal","Language","Year","Month","First Author Country","Last Author Country","DOI","DOI URL","DOI MA","Country study","Location ","Keywords","Keywords MA"
"Handbook of meta-analysis in ecology and evolution.","Vetter Daniela","Vetter Daniela","Meta-analysis is a powerful statistical methodology for synthesizing research evidence across independent studies. This is the first comprehensive handbook of meta-analysis written specifically for ecologists and evolutionary biologists, and it provides an invaluable introduction for beginners as well as an up-to-date guide for experienced meta-analysts. The chapters walk readers through every step of meta-analysis, from problem formulation to the presentation of the results. The book identifies both the advantages of using meta-analysis for research synthesis and the potential pitfalls and limitations of meta-analysis (including when it should not be used). Different approaches to carrying out a meta-analysis are described, and include moment and least-square, maximum likelihood, and Bayesian approaches, all illustrated using worked examples based on real biological datasets. The book is tailored to the biological sciences, and will provide an invaluable text for practitioners from graduate students and senior scientists to policymakers in conservation and environmental management.","QUARTERLY REVIEW OF BIOLOGY","en",2014,"Jan","Switzerland","Switzerland","10.23943/princeton/978069113728501001","https://doi.org/10.1016/j.soilbio.2004.07.035 ","10.1002/ecy.2936","USA","Glendale, Arizona","N/A","ammonium; earthworm ecological group; element flux; exotic earthworms; nitrate; nitrification; nitrogen; nutrient cycling; pH; phosphorus; soil carbon; water content. "
"Soil ecology. Springer Science Business Media.","Patrick Lavelle","Alister V. Spain","A number of excellent textbooks on general ecology are currently available but‚ to date‚ none have been dedicated to the study of soil ecology. This is important because the soil‚ as the ‘epidermis’ of our planet‚ is the major component of the terrestrial biosphere. In the present age‚ it is difficult to understand how one could be interested in general ecology without having some knowledge of the soil and further‚ to study the soil without taking into account its biological components and ecological setting. It is this deficiency that the two authors‚ Patrick Lavelle and Alister Spain‚ have wished to address in writing their text. A reading of this work‚ entitled ‘Soil Ecology’‚ shows it to be very complete and extremely innovative in its conceptual plan. In addition‚ it follows straightforwardly through a development which unfolds over four substantial chapters. Firstly‚ the authors consider the soil as a porous and finely divided medium of b- organomineral origin‚ whose physical structure and organisation foster the development of a multitude of specifically adapted organisms (microbial communities‚ roots of higher plants‚ macro-invertebrates). ","Book","en",2001,"Aug","France","Australia","10.1007/s00248-005-8001-4","https://link.springer.com/book/9789401752817 ","10.1002/ecy.2936","N/A","N/A","biodiversity;ecology;environment;soil;soil quality;sustainability  ","ammonium; earthworm ecological group; element flux; exotic earthworms; nitrate; nitrification; nitrogen; nutrient cycling; pH; phosphorus; soil carbon; water content. "
"Effects of earthworms on soil organic matter and nutrient dynamics at a landscape scale over decades","Patrick Lavelle","Nicolas Bernier","This chapter synthesizes information on the effects of earthworms on soil systems at scales longer than 1 year, and earthworm behavior that may affect these processes is detailed.","Book : Earthworm ecology","en",2004,"Feb","France","France","10.1201/9781420039719.pt4","https://hal.science/hal-00497245/document","10.1002/ecy.2936","Ivory Coast / Peru","Lamto / Yarimaguas ","N/A","ammonium; earthworm ecological group; element flux; exotic earthworms; nitrate; nitrification; nitrogen; nutrient cycling; pH; phosphorus; soil carbon; water content. "
"Influence of nonnative earthworms on mycorrhizal colonization of sugar maple (Acer saccharum).","Beth Lawrence","Esteban R. Suárez"," •; Exotic earthworms can modify or eliminate surface organic (Oe/Oa) horizons in cold-temperate forest ecosystems and have profound effects on the forest soil environment, especially the rooting zone.;•; We examined the effects of earthworm colonization of northern hardwood forest soils on the abundance and morphology of mycorrhizal fungi associated with sugar maple ( Acer saccharum ). We compared mycorrhizal associations of areas of earthworm invasion with those of reference (no-worm) areas in Arnot Forest, central New York, USA.;•; The organic horizon in reference areas had higher mycorrhizal colonization rates and higher colonized root length than did surface layers in areas with active earthworm populations. Hyphal coils were more abundant and also formed a greater proportion of total fungal colonization in reference plots. Vesicles were more abundant and were a higher contribution to total colonization in earthworm plots, indicating a possible stress response to the presence of earthworms.;•; By affecting mycorrhizal colonization and morphology, earthworms may influence nutrient uptake capacity of dominant forest species. Our results suggest that a profound change in the mycorrhizal system will be one component of the potential ecosystem effects of invasion of new forest habitat by nonnative earthworms. ","New Phytologist","en",2002,"Dec","USA","USA","10.1046/j.1469-8137.20030649.x"," https://doi.org/10.1046/j.1469-8137.2003.00649.x ","10.1002/ecy.2936","USA","Cayuta, New York","mycorrhizas;arbuscular mycorrhizal (AM) fungi;earthworms;sugar maple (Acer saccharum);forest floor  ","ammonium; earthworm ecological group; element flux; exotic earthworms; nitrate; nitrification; nitrogen; nutrient cycling; pH; phosphorus; soil carbon; water content. "
"Greenhouse-gas emissions from soils increased by earthworms.","Ingrid M. Lubbers","J.W. Groenigen","Earthworms play an essential part in determining the greenhouse-gas balance of soils worldwide, and their influence is expected to grow over the next decades. They are thought to stimulate carbon sequestration in soil aggregates, but also to increase emissions of the main greenhouse gases carbon dioxide and nitrous oxide. Hence, it remains highly controversial whether earthworms predominantly affect soils to act as a net source or sink of greenhouse gases. Here, we provide a quantitative review of the overall effect of earthworms on the soil greenhouse-gas balance. Our results suggest that although earthworms are largely beneficial to soil fertility, they increase net soil greenhouse-gas emissions.","Nature Climate Change ","en",2013,"Feb","The Netherlands ","The Netherlands","10.3410/f.718002379.793475379","http://dx.doi.org/10.3410/f.718002379.793475379","10.1002/ecy.2936","N/A","N/A","Biogeochemistry;Climate sciences ","ammonium; earthworm ecological group; element flux; exotic earthworms; nitrate; nitrification; nitrogen; nutrient cycling; pH; phosphorus; soil carbon; water content. "
"Short-and long-term effects of the endogeic earthworm Millsonia anomala (Omodeo) (Megascolecidæ,Oligochaeta) of tropical savannas, on soil organic matter.","A. Martin","A. Martin","This study aimed to establish the effects of iMillsonia anomala/i, a tropical geophagous earthworm common in the humid savannas of Lamto (Ivory Coast), on soil organic matter dynamics over different time scales under laboratory conditions. The texture of casts produced by the worms fed on a shrub savanna soil was not significantly different from that of the soil, which showed that iM. anomala/i ingested soil particles without selection. Physical fractionation of soil organic matter showed that the coarse organic fraction (250–2000 μm) was depleted by 25–30% in fresh casts compared to the control noningested soil; this was mainly due to a fragmentation of coarse organic debris. Incubation of casts and a 2-mm sieved control soil under laboratory conditions for more than 1 year showed that the C mineralisation rate was almost four times lower in the casts (3% year-1) than in the control soil (11% year-1). We therefore concluded that on a long time scale iM. anomala/i populations may significantly reduce the decomposition rate of soil organic matter in Lamto savannas.","Biology and fertility of soils ","en",1991,"June","France","France","10.1007/bf00335774","http://dx.doi.org/10.1007/bf00335774","10.1002/ecy.2936","Ivory Coast","Lamto ","Geophagous tropical earthworm;Soil organic matter;Assimilation;Physical fractionation;Dynamics of organic matter;Tropical savannas;Millsonia anomala ","ammonium; earthworm ecological group; element flux; exotic earthworms; nitrate; nitrification; nitrogen; nutrient cycling; pH; phosphorus; soil carbon; water content. "
"Plant diversity and ecosystem productivity: theoretical considerations.","David Tilman","Kendall T. Thomson","Ecosystem processes are thought to depend on both the number and  identity of the species present in an ecosystem, but mathematical  theory predicting this has been lacking. Here we present three simple  models of interspecific competitive interactions in communities  containing various numbers of randomly chosen species. All three models  predict that, on average, productivity increases asymptotically with  the original biodiversity of a community. The two models that address  plant nutrient competition also predict that ecosystem nutrient retention increases with biodiversity and that the effects of biodiversity on productivity and nutrient retention increase with interspecific differences in resource requirements. All three models show that both species identity and biodiversity simultaneously influence ecosystem functioning, but their relative importance varies greatly among the models. This theory reinforces recent experimental results and shows that effects of biodiversity on ecosystem functioning are predicted by well-known ecological processes.","Ecology ","en",1997,"Mar","USA","USA","10.1073/pnas.94.5.1857","http://dx.doi.org/10.1073/pnas.94.5.1857","10.1002/ecy.2936","N/A","N/A","Biodiversity;resource competition;soil fertility;nutrient use;retention ","ammonium; earthworm ecological group; element flux; exotic earthworms; nitrate; nitrification; nitrogen; nutrient cycling; pH; phosphorus; soil carbon; water content. "
"Microbial respiration, biomass, biovolume and nutrient status in burrow walls of Lumbricus terrestris L. (Lumbricidae).","Alexei V. Tiunov","Stefan Scheu","Chemical characteristics and microbial activity were studied in burrow walls of the anecic earthworm species Lumbricus terrestris and in control soil of a lime (Tilia cordata), oak (Quercus robur) and beech (Fagus sylvatica) forest. Samples were taken in June and October at distances of 0–4 (drilosphere), 8–12 and 50–60 (control soil) mm from earthworm burrows. The following variables were measured: organic C, total N, moisture, pH, basal respiration, microbial biomass (SIR method), fungal and bacterial volume (epifluorescence microscopy) and nutrient (C, N and P) limitation of microbial growth. Organic C and total N contents increased in the burrow walls by factors of 1.8–3.5 and 1.3–2.2, respectively, compared to the control soil. The moisture content and pH (up to 1.2 units) was higher. Basal respiration, microbial biomass and bacterial volume in the drilosphere exceeded those in control soil significantly by factors of 3.7–9.1, 2.3–4.7 and 2.1–5.4, respectively. Changes in fungal volume with vicinity to burrows differed between forest sites. Fungal volume was increased significantly by factors of 1.9–3.4 in the earthworm burrow walls in the oak and beech forest, but was similar to that in control soil in the lime forest. Microbial growth in the control soil was limited by N in the oak forest and by N and P in the lime and beech forest. The nutrient status of the microflora changed little in vicinity to burrows. However, microbial N and P demand in earthworm burrow walls exceeded that in soil. The specific respiration (qO2) was increased and the growth response to nutrient additions was faster in the burrow walls suggesting that the microbial community in the burrow walls contains a larger fraction of metabolically-active microorganisms, adapted to continuous resource additions by earthworm faeces and mucus. Enrichment in organic matter, but also other mechanisms, particularly the activity of microbivorous soil animals, are presumably responsible for the formation of a specific microbial community in earthworm burrow walls. It is concluded that L. terrestris burrow walls are stable microhabitats which sustain a large and active microbial community and are likely to play an important role in the soil system by regulating microbial-mediated chemical processes.","Soil Biology and Biochemistry","en",1999,"Dec","Russia","Germany","10.1016/s0038-0717(99)00127-3","http://dx.doi.org/10.1016/s0038-0717(99)00127-3","10.1002/ecy.2936","Russia / Germany","Moscou / Göttingen","Earthworms;drilosphere;microorganisms;substrate induced respiration;limitation;nitrogen;phosphorus;forest ","ammonium; earthworm ecological group; element flux; exotic earthworms; nitrate; nitrification; nitrogen; nutrient cycling; pH; phosphorus; soil carbon; water content. "
"Microflora, protozoa and nematoda in Lumbricus terrestris burrow walls: a laboratory experiment.","Alexei V. Tiunov","Stefan Scheu","Anecic earthworms emLumbricus terrestris L. were kept in laboratory microcosms containing soil and litter from a lime (emTilia cordata) and beech (emFagus sylvatica) forest. Nutrient (mineral nitrogen and phosphorus) contents, microbial activity and densities of protozoa and nematodes were determined in burrow walls and control soils after 165 days. Well-developed burrow linings consisting of earthworm faeces were formed in the “emTilia” treatment, but not in the “emFagus” treatment, presumably because beech litter was not an adequate food resource for emL. terrestris. Consequently, increases in microbial biomass, basal respiration and microbial volume in burrow walls compared to surrounding soil were significant in the “emTilia” treatment only. However, in both treatments burrow walls were strongly enriched in mineral nitrogen and phosphorus. The density and biomass of protozoa were significantly greater in burrow walls compared to the control soil. The numbers of naked amoebae increased by similar factors of 4 and 3.5 in burrow walls of the “emTilia” and “emFagus” treatment, respectively. Flagellate density increased more than tenfold in burrow walls of the “emTilia” treatment but only twofold in the “emFagus” treatment. In addition, a comparatively large ciliate population was present in burrow walls in the “emTilia” treatment. The total abundance of protozoa was significantly correlated with the contents of inorganic N and P in the samples (emr = 0.68 and 0.63 respectively, P&lt; 0.03) suggesting that protozoan grazing participated in the mobilisation of nutrients from microbial biomass. The total nematode density was increased in burrow walls by a factor of 3 in the “emTilia” treatment (mostly due to bacterivorous nematodes), but was not affected in the “emFagus” treatment. In both treatments density of fungivorous nematodes increased, while that of plant parasites decreased in burrow walls compared to the control soil. It is concluded that the grazing pressure of protozoa and nematodes may control the dynamics of the microbial succession in earthworm burrow walls, strongly affecting nutrient cycling processes in these microhabitats.","Pedobiologia","en",2000,"Aug","Russia","Germany","10.1078/0031-4056-00067","http://dx.doi.org/10.1078/0031-4056-00067","10.1002/ecy.2936","Russia / Germany","Moscou / Göttingen","Soil microflora;nutrient mineralization;nematodes;Protozoa;anecic;earthworms;Lumbricus terrestris;drilosphere","ammonium; earthworm ecological group; element flux; exotic earthworms; nitrate; nitrification; nitrogen; nutrient cycling; pH; phosphorus; soil carbon; water content. "
"The unseen invaders: introduced earthworms as drivers of change in plant communities in North American forests (a meta-analysis).","Dylan Craven","Nico Eisenhauer","Globally, biological invasions can have strong impacts on biodiversity as well as ecosystem functioning. While less conspicuous than introduced aboveground organisms, introduced belowground organisms may have similarly strong effects. Here, we synthesize for the first time the impacts of introduced earthworms on plant diversity and community composition in North American forests. We conducted a meta‐analysis using a total of 645 observations to quantify mean effect sizes of associations between introduced earthworm communities and plant diversity, cover of plant functional groups, and cover of native and non‐native plants. We found that plant diversity significantly declined with increasing richness of introduced earthworm ecological groups. While plant species richness or evenness did not change with earthworm invasion, our results indicate clear changes in plant community composition: cover of graminoids and non‐native plant species significantly increased, and cover of native plant species (of all functional groups) tended to decrease, with increasing earthworm biomass. Overall, these findings support the hypothesis that introduced earthworms facilitate particular plant species adapted to the abiotic conditions of earthworm‐invaded forests. Further, our study provides evidence that introduced earthworms are associated with declines in plant diversity in North American forests. Changing plant functional composition in these forests may have long‐lasting effects on ecosystem functioning.","Global Change Biology","en",2016,"Mar","Germany","Germany","10.1111/gcb.13446","http://dx.doi.org/10.1111/gcb.13446","10.1002/ecy.2936","North America (data)","forests ecosystems","introduced earthworms;plant communities;plant diversity;biological invasions;earthworm invasion;community composition;meta-analysis ","ammonium; earthworm ecological group; element flux; exotic earthworms; nitrate; nitrification; nitrogen; nutrient cycling; pH; phosphorus; soil carbon; water content. "
"Factors affecting earthworm abundance in soils.","C. A. Edwards","C. A. Edwards","Earthworm populations show a considerable amount of variability in time and space, with mean population densities and biomass ranging from fewer than 10 individuals and 1 g m–2, respectively, to more than 1000 individuals and 200 g m–2, respectively, under favorable conditions. However, within particular climatic zones, earthworm assemblages, with fairly characteristic species richness, composition, abundance, and biomass, can often be recognized in broadly different habitat types, such as coniferous forests, deciduous woodland, grassland, and arable land. There is a considerable volume of literature describing the earthworm communities of such habitats, and much of this was summarized by Lee (1985) and updated by Edwards and Bohlen (1996). There is also a considerable amount of information describing the influence of various environmental and management factors on earthworm populations, but in comparison with insects, for which the population ecology of 92many species has been subjected to quantitative analysis, earthworm population ecology is still largely at a descriptive stage. Population modeling has been used for particular purposes such as risk assessment (Baveco and De Roos 1996), but development of realistic models of field populations has been hindered by a lack of information on key life history parameters and the factors that influence them.","Book : Earthworm ecology","en",2004,"Mar","England","England","10.1201/9781482285246-9","http://dx.doi.org/10.1201/9781482285246-9","10.1002/ecy.2936","Worldwide","Various","Earthworm Biology;Ecology;Behavior;and Physiology","ammonium; earthworm ecological group; element flux; exotic earthworms; nitrate; nitrification; nitrogen; nutrient cycling; pH; phosphorus; soil carbon; water content. "
"Earthworm Ecology.","Mary Keen","Mary Keen","Since the publication of the highly-successful first edition of Earthworm Ecology, there were two international symposia and an increased number of publications on the subject, demanding a revision of the book that addresses the most rapidly developing areas of earthworm research.Earthworm Ecology, Second Edition updates the most comprehensive work available on earthworm ecology with extensive revisions of the original chapters. This well-illustrated, expansive study examines the important, and often overlooked, impact earthworms have on the environment. It discusses the impact of climate, soil properties, predation, disease and parasitism, and competition upon earthworm ecology.New chapters analyze the history of earthworm research, the importance of earthworms as representatives of soil fauna and how they affect plant growth, the effects of the invasion of exotic earthworms into North America and other regions, and vermiculture and vermicomposting in Europe and Asia. This new material makes this volume an essential reference work for soil scientists, agronomists, and others with a great interest in earthworms.","Book: Biopharmaceutics and drug disposition ","en",1991,"May","England","England","10.1002/bdd.2510120409","http://dx.doi.org/10.1002/bdd.2510120409","10.1002/ecy.2936","N/A","N/A","neurotransmitter receptors;cellular pharmacology;behavioural  pharmacology;drug metabolism;pharmacometrics;autonomic pharmacology","ammonium; earthworm ecological group; element flux; exotic earthworms; nitrate; nitrification; nitrogen; nutrient cycling; pH; phosphorus; soil carbon; water content. "
"The action of an animal ecosystem engineer: Identification of the main mechanisms of earthworm impacts on soil microarthropods. ","Nico Eisenhauer","Nico Eisenhauer","pNon-trophic interactions are shaping soil food web structure and functions. Particularly, the action of ecosystem engineers, such as earthworms, are likely to fundamentally impact the abiotic and biotic properties of their environment. The present study aimed to identify the main mechanisms through which earthworms belonging to varying ecological groups – epigeic, endogeic and anecic species – affect soil microarthropods by reviewing the literature on this topic and by performing meta-analyses./ppEarthworm ecological groups differed considerably in their impacts on microarthropods, whereas effects did not vary significantly between microarthropod taxa at the habitat scale. Inconsistent impacts of epigeic species on soil microarthropods are most likely due to differences in earthworm densities. Effects can thus be positive in the case of moderate densities or negative in the case of high densities and associated distinct changes in the physical structure of the upper soil organic layers. By contrast, impacts of endogeic earthworms appeared to be mainly negative and were primarily due to competition with microarthropods for food resources. Consequently, negative impacts on soil microarthropods intensified with increasing earthworm density and biomass. This interaction between endogeic earthworms and microarthropods is better referred to as amensalism due to the competitive predominance of earthworms. Impacts of anecic earthworm species differed significantly from that of endogeic ones; they were neutral at the habitat scale and positive on the microhabitat scale. Moreover, impacts were independent of earthworm densities due to the quasi-territorial behaviour of anecic earthworms. Positive effects were mainly attributed to the formation of stable microhabitats by anecic species; namely burrows/middens, rich in nutrients and microorganisms./ppThe present study points to the relevance of the non-trophic biotic interactions that drive the composition of belowground food webs by identifying the most essential mechanisms underlying the impacts of animal ecosystem engineers on soil microarthropods. Moreover, as earthworms emerge as important biological invaders, the results of the present study may help to fully appreciate, estimate and model the consequences of this momentous global change phenomenon. Particularly, the spread of exotic epigeic and endogeic earthworm species likely threatens soil microarthropod density, diversity and functions./p","Pedobiologia.","en",2010,"Apr","Germany","Germany","10.1016/j.pedobi.2010403"," https://doi.org/10.1016/j.pedobi.2010.04.003 ","10.1002/ecy.2936","Various","Forest; grassland; field","Anecic earthworms;Earthworm invasion;Endogeic earthworms;Epigeic earthworms;Non-trophic interactions","ammonium; earthworm ecological group; element flux; exotic earthworms; nitrate; nitrification; nitrogen; nutrient cycling; pH; phosphorus; soil carbon; water content. "
