"Title","First author","Last author","Abstract","Journal","Language","Year","Month","First Author Country","Last Author Country","DOI","DOI URL","DOI MA","Country study","Location ","Keywords","Keywords MA"
"Earthworm species composition affects the soil bacterial community and net nitrogen mineralization.","Maria B. Postma-Blaauw","Lijbert Brussaard","Knowledge of the effects of species diversity within taxonomic groups on nutrient cycling is important for understanding the rote of soil biota in sustainable agriculture. We hypothesized that earthworm species specifically affect nitrogen mineralization, characteristically for their ecological. group classifications, and that earthworm species interactions would affect mineralization through competition and facilitation effects. A mesocosm experiment was conducted to investigate the effect of three earthworm species, representative of different ecological. groups (epigeic: Lumbricus rubellus; endogeic: Aporrectodea caliginosa tuberculata; and anecic: Lumbricus terrestris), and their interactions on the bacterial. community, and on nitrogen mineralization from N-15-labelled crop residue and from soil organic matter.  Our results indicate that L. rubellus and L. terrestris enhanced mineralization of the applied crop residue whereas A. caliginosa had no effect. On the other hand, L. rubellus and A. caliginosa enhanced mineralization of the soil, organic matter, whereas L. terrestris had no effect. The interactions between different earthworm species affected the bacterial. community and the net mineralization of soil organic matter. The two-species interactions between L. rubellus and A. caliginosa, and L. rubellus and L. terrestris, resulted in reduced mineral N concentrations derived from soil organic matter, probably through increased immobilization in the bacterial biomass. In contrast, the interaction between A. caliginosa and L. terrestris resulted in increased bacterial growth rate and reduced total soil C. When all three species were combined, the interaction between A. caliginosa and L. terrestris was dominant. We conclude that the effects of earthworms on nitrogen mineralization depend on the ecological traits of the earthworm species present, and can be modified by species interactions. Knowledge of these effects can be made useful in the prevention of nutrient losses and increased soil fertility in agricultural systems, that typically have a low earthworm diversity. ","PEDOBIOLOGIA ","en",2006,"Jan","USA","The Netherlands","10.1016/j.pedobi.2006201","https://doi.org/10.1016/j.pedobi.2006.02.001","10.1038/srep06365","The Netherlands","‘De Bovenbuurt’ (51°59′N, 5°40′E)","soil;earthworms;biodiversity;species interactions;nutrients;functional groups","introduced earthworms; plant communities; plant diversity; biological invasions; earthworm invasion; community composition; meta-analysis"
"Inorganic and organic phosphorus pools in earthworm casts (Glossoscolecidae) and a Brazilian rainforest Oxisol.","Christienne N. Kuczak","Flavio J. Luizão","We compared differences in soil phosphorus fractions between large earthworm casts (Family Glossoscolecidae) and surrounding soils, i.e., Oxisols in 10 year-old upland agroforestry system (AGR), pasture (PAS), and secondary forest (SEC) in the Central Brazilian Amazon. AGR and PAS both received low-input fertilization and SEC received no fertilization. We found that earthworm casts had higher levels of organic hydroxide P than surrounding soils, whereas fertilization increased inorganic hydroxide P. Inorganic P was increased by fertilization, and organic P was increased by earthworm gut passage and/or selection of ingested materials, which increased available P (sum of resin and bicarbonate fractions) and moderately available P (sum of hydroxide and dilute acid fractions), and P fertilizer application and land-use increased available P. The use of a modified sequential P fractionation produced fewer differences between earthworm casts and soils than were expected. We suggest the use of a condensed extraction procedure with three fractions (Available P, Moderately Available P, and Resistant P) that provide an ecologically based understanding of the P availability in soil. Earthworm casts were estimated to constitute 41.0, 38.2, and 26.0 kg ha(-1) of total available P stocks (sum of resin and bicarbonate fractions) in the agroforestry system, pasture, and secondary forest, respectively. ","SOIL BIOLOGY & BIOCHEMISTRY ","en",2006,"Mar","USA","Brazil","10.1016/j.soilbio.2005607","https://doi.org/10.1016/j.soilbio.2005.06.007","10.1038/srep06365","Brazil","Central Brazilian Amazon.","agroforestry;Amazonia;Bactris gasipaes;Bertholletia excelsaoxisol;pasture;secondary forest;sequential phosphorus extraction ","introduced earthworms; plant communities; plant diversity; biological invasions; earthworm invasion; community composition; meta-analysis"
"Effects of earthworms on Phosphorus dynamics - a review."," R.C. Le Bayon","Roxane Milleret ","Belowground biotic interactions are known to influence soil fertility and plant growth by changing the physical environment and the soil nutrient cycles. Among the great diversity of soil biota, earthworms are keystone soil organisms in regulating nutrient cycling through: (i) their own metabolism that leads to high availability of carbon (C) and nitrogen (N) from metabolic wastes such as urine, mucus and tissue, (ii) the dispersal and the stimulation of soil microorganism activity associated with passage through the intestinal tract and (iii) the distribution and the mixing of organic matter and soil mineral particles. While many studies have examined impacts of earthworm on C and N fluxes in soils, less attention has been paid to the impact of earthworms on soil phosphorus (P). This paper reviews the current state of knowledge of the global earthworm’s impact on soil P dynamics in order to evaluate further involvements: i) on plant production and ii) on P transfer by runoff waters at the plot scale. This mini-review aims at considering research issues at several ecological levels, from individual earthworms (P distribution during food assimilation and excretion; gut microbial activities) to earthworm populations and communities (ecological categories and their influence on P dynamics) and, to the full extent, to the ecosystem scale (storage and/or loss of P). Interacting effects with other organisms (plants, microorganisms) are taken into account as well as the role of earthworms on physicochemical parameters (casting and burrowing activities, soil stability). Such a synthesis highlights the necessity to conduct interdisciplinary studies on biological, chemical and physical processes to better understand the effects of earthworms on P cycling at the ecosystem and landscape levels.","Dynamic Soil, Dynamic Plant (book)","en",2009,"N/A","Switzerland","Switzerland","10.1201/9781482285246-12","https://www.researchgate.net/publication/40783737_Effects_of_Earthworms_on_Phosphorus_Dynamics_-_A_Review","10.1038/srep06365","Wordlwide (« terrestrial ecosystems »)","Various","drilosphere;ecological level;erosion;microorganism;plant","introduced earthworms; plant communities; plant diversity; biological invasions; earthworm invasion; community composition; meta-analysis"
"Movement of N from decomposing earthworm tissue to soil, microbial and plant N pools.","Joann K. Whalen","Jessica L. Vanarsdale","A microcosm experiment was made to determine the fate of nitrogen released from N-15-labelled decomposing earthworms (Lumbricus terrestris) in soil in the presence or absence of ryegrass seedlings (Lolium perenne). Earthworm tissue (2.0% N-15 atom enriched) was added to each microcosm. Nitrogen movement from earthworm tissue to soil N [mineral N (NH4-N + NO3-N), dissolved organic N (DON) and organic N], microbial biomass N and plant shoot N pools was determined by destructive sampling at 1, 2, 4, 8 and 16 d. Earthworm tissues decomposed rapidly, and no tissue was visible after 4 d. Initially in pots without plants, most of the N from earthworm tissue was found in the organic N pool, however, as much as 55% of the N from decomposing earthworm tissue was incorporated into microbial biomass after 2 d. Much less of the N from earthworm tissue was transformed into DON and mineral N forms after 2 d. The DON and mineral N pools contained 13-18% and 4-7% of the N from earthworm tissue, respectively, from d 2 to 16. By the end of the experiment, N from earthworm tissue in the microbial biomass N pool declined to 29% while the amount of N from earthworm tissue in the organic N pool increased to 49%. The increase in the organic N may have resulted from the production of new organic compounds such as microbial by-products. In pots with plants, N from earthworm tissue was rapidly incorporated into microbial biomass, and by d 2, the microbial biomass N pool contained 40% of the N from earthworm tissue. Mineral N, DON and microbial biomass N concentrations were lower in pots with ryegrass seedlings compared to pots without plants, and after d 2 declined to almost undetectable amounts because of rapid plant uptake. Between 42-52% of the N from earthworm tissue was found in the organic N pool from d 1 to 8, and then declined to 19% by d 16. After 16 d, over 70% of the N added as earthworm tissue was incorporated into plant shoot biomass. Our results demonstrate that the movement of N from dead earthworm tissue into microbial biomass was extremely rapid, and in pots without plants, much of this N was transformed into organic N forms, while in pots with ryegrass, most of the N from earthworm tissue accumulated in ryegrass shoots.","SOIL BIOLOGY & BIOCHEMISTRY","en",1999,"Apr","Canada","USA","10.1016/s0038-0717(97)00252-6","http://dx.doi.org/10.1016/s0038-0717(97)00252-6","10.1038/srep06365","USA","Wooster, Ohio","Keywords +: EXTRACTION METHOD;NITROGEN;BIOMASS;FUMIGATION ","introduced earthworms; plant communities; plant diversity; biological invasions; earthworm invasion; community composition; meta-analysis"
"Effects of earthworm inoculation upon the root-growth of direct drilled cereals.","C. A. Edwards","J. R. Lofty","(1) Normal field populations of deep-burrowing or shallow-working earthworms were inoculated into small plots that had been sterilized with dichloropropane-dichloropropene (D.D.????), on a site that had been directly drilled with cereals for six successive years. Inoculation with deep-burrowing species (Lumbricus terrestris and Allolobophora longa) significantly increased barley plant populations and the weight and depth of roots and height and amount of foliage. Most of the straw debris on the soil surface was incorporated into the soil in the earthworm-inoculated plots, compared with very little in plots with no earthworms. Yield was also increased significantly by earthworm inoculation. (2) In box experiments, comparing the influence of natural and simulated earth-worm burrows on root growth, it was shown that, although the provision of channels for roots to grow was important, the improved root growth was also partially due to the lining of the burrows with more available nutrients than the surrounding soil. Other experiments demonstrated that the nitrogen from dead earthworms was insufficient to account for increased root growth. Ways of encouraging the build-up of earthworm populations in direct drilled land are discussed.","JOURNAL OF APPLIED ECOLOGY ","en",1980,"Dec","USA","England","10.2307/2402635","http://dx.doi.org/10.2307/2402635","10.1038/srep06365","N/A","N/A","N/A","introduced earthworms; plant communities; plant diversity; biological invasions; earthworm invasion; community composition; meta-analysis"
"Influence of earthworms on soil productivity.","HENRY HOPP","CLARENCE S. SLATER","N/A","Soil Science ","en",1948,"Dec","USA","USA","10.1097/00010694-194812000-00003","http://dx.doi.org/10.1097/00010694-194812000-00003","10.1038/srep06365","N/A ","NA ","N/A","introduced earthworms; plant communities; plant diversity; biological invasions; earthworm invasion; community composition; meta-analysis"
"Land-use and land-management change: relationships with earthworm and fungi communities and soil structural properties.","David J Spurgeon","Jack H Faber","Background: Change in land use and management can impact massively on soil ecosystems. Ecosystem engineers and other functional biodiversity in soils can be influenced directly by such change and this in turn can affect key soil functions. Here, we employ meta-analysis to provide a quantitative assessment of the effects of changes in land use and land management across a range of successional/extensification transitions (conventional arable -> no or reduced tillage -> grassland -> wooded land) on community metrics for two functionally important soil taxa, earthworms and fungi. An analysis of the relationships between community change and soil structural properties was also included.  Results: Meta-analysis highlighted a consistent trend of increased earthworm and fungal community abundances and complexity following transitions to lower intensity and later successional land uses. The greatest changes were seen for early stage transitions, such as introduction of reduced tillage regimes and conversion to grassland from arable land. Not all changes, however, result in positive effects on the assessed community metrics. For example, whether woodland conversion positively or negatively affects community size and complexity depends on woodland type and, potentially, the changes in soil properties, such as pH, that may occur during conversion. Alterations in soil communities tended to facilitate subsequent changes in soil structure and hydrology. For example, increasing earthworm abundances and functional group composition were shown to be positively correlated with water infiltration rate (dependent on tillage regime and habitat characteristics); while positive changes in fungal biomass measures were positively associated with soil microaggregate stability.  Conclusions: These findings raise the potential to manage landscapes to increase ecosystem service provision from soil biota in relation to regulation of soil structure and water flow.","BMC ECOLOGY ","en",2013,"Dec","UK ","The Netherlands","10.1186/1472-6785-13-46","http://dx.doi.org/10.1186/1472-6785-13-46","10.1038/srep06365","Various (meta-analysis)","Various","Meta analysis;Earthworm;Fungi;Functional biodiversity;Soil porosity;Microaggregate stability ","introduced earthworms; plant communities; plant diversity; biological invasions; earthworm invasion; community composition; meta-analysis"
"Soil invertebrates and ecosystem services.","Lavelle, Patrick","Rossi, Jean-Pierre","Invertebrates play significant, but largely ignored, roles in the delivery of ecosystem services by soils at plot and landscape scales. They participate actively in the interactions that develop in soil among physical, chemical and biological processes. We show that soils have all the attributes of self-organized systems as proposed by Perry (Trends Ecol. Evol. 10 (1995) 241) and detail the scales at which invertebrates operate and the different kinds of ecosystem engineering that they develop. This comprehensive analysis of invertebrate activities shows that they may be the best possible indicators of soil quality. They should also be considered as a resource that needs to be properly managed to enhance ecosystem services provided by agro-ecosystems.","EUROPEAN JOURNAL OF SOIL BIOLOGY ","en",2006,"Nov","France","France","10.1093/acprof:oso/978019957592303005","http://dx.doi.org/10.1093/acprof:oso/978019957592303005","10.1038/srep06365","Review (general conceptual overview)","Various","Soil invertebrates;Ecosystem engineers;Self-organized systems;Bioindicators ","introduced earthworms; plant communities; plant diversity; biological invasions; earthworm invasion; community composition; meta-analysis"
"Soil fertility concepts over the past two centuries: the importance attributed to soil organic matter in developed and developing countries.","Christian Feller","Raphaël Manlay","The theories about plant nutrition and soil fertility varied widely from the antiquity to the middle of the nineteenth century, with major (Thaer A. 1809. Grundsatze der rationellen Landwirtschaft (1809-1812). Berlin (Germany): Realschulbuch Ed.) or minor (Liebig J. 1840. Die organische Chemie in ihrer Anwendung auf Agrikultur und Physiologie. Braunschweig (Germany): Vieweg) importance attributed to soil humus or soil organic matter (SOM). The importance assigned to humus over the past two centuries will be developed in this historical paper. Intensification of agriculture in the twentieth century permitted an important increase in cultivated plant yield of food, fiber, wood, and biofuel production, not only in the northern countries, but also in some southern countries (e.g., India and China) with the emergence of the Green Revolution. However, the question of organic restitutions and the maintenance (or increase) of the SOM stock was, at times, not taken into consideration; consequently, there was a general decrease in SOM stock for many tropical soils. It is now widely accepted by scientists that SOM depletion is one of the major factors leading to degradation of ecosystem services and loss of ecosystem resilience: new alternatives are now necessary for the maintenance and/or increase in plant productivity and production of environmental services by agriculture. Therefore, this paper will also present some recent research in different tropical countries with a focus on agroecological management of tropical soils.","ARCHIVES OF AGRONOMY AND SOIL SCIENCE ","en",2012,"Jan","France","France","10.1080/03650340.2012.693598","http://dx.doi.org/10.1080/03650340.2012.693598","10.1038/srep06365","Various (historical paper)","Various","soil fertility history;soil fertility concepts;soil organic matter;ecosystem services ","introduced earthworms; plant communities; plant diversity; biological invasions; earthworm invasion; community composition; meta-analysis"
"Ecology of arable land: perspectives and challenges","M. Clarholm","Berström L.","Over the past two decades, nutrient budgets have been constructed for a number of specific ecosystems ranging from croplands to forests. However, relatively few studies have focused on the transfers between and among ecosystem types. These transfers and their dynamics depend on properties of the landscape units themselves as well as various mechanisms that influence inter-ecosystem transfers driven by such as atmospheric, hydrological and biological conditions. The movements of nutrients, especially nitrogen, and phosphorous, are subject to several processes such as absorption, adsorption, transformation and immobilization. Thus, the particular pathway of transfer across the landscape and the rates of movement depend on both transfer mechanisms and ecosystem properties. This paper reviews the current understanding of nutrient flows across the landscape, suggests some generalities, and presents recommendations for future research.","Ecology of Arable Land — Perspectives and Challenges (book)","en",1989,"N/A","Sweden ","Sweden","10.1007/978-94-009-1021-8_23","http://dx.doi.org/10.1007/978-94-009-1021-8_23","10.1038/srep06365","N/A","N/A","N/A","introduced earthworms; plant communities; plant diversity; biological invasions; earthworm invasion; community composition; meta-analysis"
"SOM management in the tropics: Why feeding the soil macrofauna?","Patrick Lavelle","Jean-Pierre Rossi","This paper synthesises information on the food requirements of soil macroinvertebrates and some of their effects on soil organic matter dynamics. Some clues to techniques that would optimise their activities through organic matter management are suggested. Soil macroinvertebrates can consume almost any kind of organic residues in mutualistic association with soil microflora. Significant amounts estimated at several T per ha of predominantly easily assimilable C are used yearly in natural ecosystems as energy to sustain these activities. Sources of C used are highly variable depending on the feeding regime. The largest part of the energy assimilated (e.g., 50% by the tropical earthworm Millsonia anomala) is actually spent in burrowing and soil transport and mixing. Bioturbation often affects several thousand tons of soil per hectare per year and several tenth of m3 of voids are created in soil. A great diversity of biogenic structures accumulate and their nature and persistance over time largely controls hydraulic soil properties. The OM integrated into the compact biogenic structures (termite mounds, earthworm globular casts) is often protected from further decomposition. Most management practices have negative effects on the diversity and abundance of macroinvertebrate communities. Structures inherited from faunal activities may persist for some weeks to years and the relationship between their disappearance and soil degradation is rarely acknowledged. When SOM supply is maintained but diversity is not, the accumulation in excess of structures of one single category may have destructive effects on soil. It is therefore essential to design practices that provide the adequate organic sources to sustain the activity and diversity of invertebrates. Special attention should also be paid to the spatial array of plots and rotations in time.","Managing Organic Matter in Tropical Soils: Scope and Limitations (book)","en",2001,"N/A","France","France","10.1007/978-94-017-2172-1_6","http://dx.doi.org/10.1007/978-94-017-2172-1_6","10.1038/srep06365","N/A","N/A","earthworms;macrofauna;organic matter management;soil structure;tropical soils","introduced earthworms; plant communities; plant diversity; biological invasions; earthworm invasion; community composition; meta-analysis"
"Organic inputs for soil fertility management in tropical agroecosystems: application of an organic resource database.","Cheryl A Palm","Ken E Giller","Organic resources play a critical role in both short-term nutrient availability and longer-term maintenance of soil organic matter in most smaller holder farming systems in the tropics. Despite this importance, there is little predictive understanding for the management of organic inputs in tropical agroecosystems. In this paper, an organic resource database (ORD) is introduced that contains information on organic resource quality parameters including macronutrient, lignin and polyphenol contents of fresh leaves, litter, stems and/or roots from almost 300 species found in tropical agroecosystems, Data on the soil and climate from where the material was collected are also included, as are decomposition and nutrient release rates of many of the organic inputs. Examples of uses of ORD are provided in the paper: (1) nutrient contents (including median values and ranges) and other resource quality parameters of farmyard manure and crop residues are compared to that of alternative nutrient sources such as different plant parts and plant types; (2) nutrient stocks found in farm boundary hedges are estimated and evaluated as a source of nutrients for soil fertility management; (3) hypotheses regarding the indices and critical values of N, lignin, and polyphenol contents for predicting N release rates are tested; (4) organic materials for soil fertility management experiments are selected. This database, when coupled with models and decision support tools, will help advance organic matter management for soil fertility improvement from an empirical to a predictive practice.","AGRICULTURE ECOSYSTEMS & ENVIRONMENT ","en",2001,"Jan","USA","The Netherlands","10.1016/s0167-8809(00)00267-x","http://dx.doi.org/10.1016/s0167-8809(00)00267-x","10.1038/srep06365","N/A","N/A","N mineralization;Lignin;Organic resource quality;Nutrient budgets;Polyphenol","introduced earthworms; plant communities; plant diversity; biological invasions; earthworm invasion; community composition; meta-analysis"
