"Title","First author","Last author","Abstract","Journal","Language","Year","Month","First Author Country","Last Author Country","DOI","DOI URL","DOI MA","Country study","Location ","Keywords","Keywords MA"
"Nitrogen oligotrophication in northern hardwood forests.","Peter M. Groffman","Pamela H. Templer","While much research over the past 30&nbsp;years has focused on the deleterious effects of excess N on forests and associated aquatic ecosystems, recent declines in atmospheric N deposition and unexplained declines in N export from these ecosystems have raised new concerns about N oligotrophication, limitations of forest productivity, and the capacity for forests to respond dynamically to disturbance and environmental change. Here we show multiple data streams from long-term ecological research at the Hubbard Brook Experimental Forest in New Hampshire, USA suggesting that N oligotrophication in forest soils is driven by increased carbon flow from the atmosphere through soils that stimulates microbial immobilization of N and decreases available N for plants. Decreased available N in soils can result in increased N resorption by trees, which reduces litterfall N input to soils, further limiting available N supply and leading to further declines in soil N availability. Moreover, N oligotrophication has been likely exacerbated by changes in climate that increase the length of the growing season and decrease production of available N by mineralization during both winter and spring. These results suggest a need to re-evaluate the nature and extent of N cycling in temperate forests and assess how changing conditions will influence forest ecosystem response to multiple, dynamic stresses of global environmental change.","Biogeochemistry","en",2018,"Dec","USA","USA","10.1007/s10533-018-0445-y","http://dx.doi.org/10.1007/s10533-018-0445-y","10.1002/ecy.2936","USA","New Hampshire","Climate change;Carbon;Dissolved organic carbon;Hubbard Brook Experimental Forest;Nitrogen","ammonium; earthworm ecological group; element flux; exotic earthworms; nitrate; nitrification; nitrogen; nutrient cycling; pH; phosphorus; soil carbon; water content. "
"Effects of European earthworm invasion on soil characteristics in northern hardwood forests of Minnesota.","Cindy M. Hale","John Pastor","European earthworms are colonizing worm-free hardwood forests across North America. Leading edges of earthworm invasion in forests of northern Minnesota provide a rare opportunity to document changes in soil characteristics as earthworm invasions are occurring. Across leading edges of earthworm invasion in four northern hardwood stands, increasing total earthworm biomass was associated with rapid disappearance of the O horizon. Concurrently, the thickness, bulk density and total soil organic matter content of the A horizon increased, and it’s percent organic matter and fine root density decreased. Different earthworm species assemblages influenced the magnitude and type of change in these soil parameters. Soil N and P availability were lower in plots with high earthworm biomass compared to plots with low worm biomass. Decreases in soil nitrogen availability associated with high earthworm biomass were reflected in decreased foliar nitrogen content for Carex pensylvanica, Acer saccharum and Asarum canadense but increased foliar N for Athyrium felix-femina. Overall, high earthworm biomass resulted in increased foliar carbon to nitrogen ratios. The effects of earthworm species assemblages on forest soil properties are related to their feeding and burrowing habits in addition to effects related to total biomass. The potential for large ecosystem consequences following exotic earthworm invasion has only recently been recognized by forest ecologists. In the face of rapid change and multiple pressures on native forest ecosystems, the impacts of earthworm invasion on forest soil structure and function must be considered.","Ecosystems ","en",2005,"Nov","USA","USA","10.1007/s10021-005-0066-x","http://dx.doi.org/10.1007/s10021-005-0066-x","10.1002/ecy.2936","USA","Chippewa National Forest of north-central Minnesota","earthworm invasion;northern hardwood forests;forest soils;Lumbricidae;exotic species invasion;ecosystem change;Acer saccharum ","ammonium; earthworm ecological group; element flux; exotic earthworms; nitrate; nitrification; nitrogen; nutrient cycling; pH; phosphorus; soil carbon; water content. "
"The unseen majority: soil microbes as drivers of plant diversity and productivity in terrestrial ecosystems.","Marcel G. A. Van Der Heijden","Nico M. Van Straalen","Microbes are the unseen majority in soil and comprise a large portion of life’s genetic diversity. Despite their abundance, the impact of soil microbes on ecosystem processes is still poorly understood. Here we explore the various roles that soil microbes play in terrestrial ecosystems with special emphasis on their contribution to plant productivity and diversity. Soil microbes are important regulators of plant productivity, especially in nutrient poor ecosystems where plant symbionts are responsible for the acquisition of limiting nutrients. Mycorrhizal fungi and nitrogen‐fixing bacteria are responsible forc.5–20% (grassland and savannah) to 80% (temperate and boreal forests) of all nitrogen, and up to 75% of phosphorus, that is acquired by plants annually. Free‐living microbes also strongly regulate plant productivity, through the mineralization of, and competition for, nutrients that sustain plant productivity. Soil microbes, including microbial pathogens, are also important regulators of plant community dynamics and plant diversity, determining plant abundance and, in some cases, facilitating invasion by exotic plants. Conservative estimates suggest thatc.20 000 plant species are completely dependent on microbial symbionts for growth and survival pointing to the importance of soil microbes as regulators of plant species richness on Earth. Overall, this review shows that soil microbes must be considered as important drivers of plant diversity and productivity in terrestrial ecosystems.","Ecology letters","en",2007,"Nov","The Netherlands","The Netherlands","10.1111/j.1461-0248.20071139.x","https://doi.org/10.1111/j.1461-0248.2007.01139.x","10.1002/ecy.2936","Worldwide","Various","Biological diversity and ecosystem functioning;microbial consortia;microbial diversity;mycorrhizal fungi;nitrogen;nitrogen fixation;phosphorus;soil  ","ammonium; earthworm ecological group; element flux; exotic earthworms; nitrate; nitrification; nitrogen; nutrient cycling; pH; phosphorus; soil carbon; water content. "
"Exotic earthworm invasions in North America: ecological and policy implications.","PAUL F. HENDRIX","PATRICK J. BOHLEN","Earthworms are the best known and, in many situations, the most important animals that live in soil. Over 3500 earthworm species have been described worldwide, and it is estimated that further surveys will reveal this number to be much larger (Reynolds 1994, Fragoso et al. 1999). Distinct taxonomic groups of earthworms have arisen on every continent except Antarctica, and, through human transport, some groups have been distributed worldwide (Jamieson 1988, Reynolds 1994). The earthworm fauna of North America, including Canada, the continental United States, Mexico, and the islands of the Caribbean, consists of both native (Nearctic and Neotropical) and exotic species imported from many other regions of the world (Fender 1995, Fragoso et al. 1995, James 1995, Reynolds 1995). Any given locality may be inhabited by all native species, all exotic species, a combination of native and exotic species, or by no earthworms at all. Relative abundance and species composition of local fauna depend greatly on soil, climate, vegetation, topography, land use history, and especially on past invasions by exotic species.  Much of our knowledge of the earthworm fauna of North America is based on the work of Gordon E. Gates who, over a 60-year career, collected, described, and cataloged many of the currently recognized taxa, both native and exotic. Beginning in 1949, Gates collaborated with the US Department of Agriculture (USDA), Bureau of Plant Quarantine (now Animal and Plant Health Inspection Service, or APHIS) to intercept oligochaetes found in “plant-associated materials” (mostly soil) being imported into the United States. Over a 32-year period (1950–1982), Gates (1976, 1982) acquired thousands of specimens and was able to determine that earthworms from all over the world were continually being imported. There is no reason to expect that this situation has changed since 1982. Indeed, as with exotic plants, fungi, and insects (Ruesink et al. 1995, Campbell 2001, Mack and Lonsdale 2001), growing global commerce may be increasing the likelihood that exotic earthworms will be introduced, both inadvertently with the importation of soil-containing materials (e.g., agricultural and horticultural products; Gates 1976, 1982, Boag and Yeates 2001, Ehrenfeld and Scott 2001) and intentionally for use in commercial applications (e.g., waste management and land bioremediation; Lee 1995, Edwards 1998). Because previous invasions by exotic earthworms have had significant impacts on soil processes and plant communities in native ecosystems (e.g., Alban and Berry 1994, Groffman and Bohlen 1999, Hale et al. 2000), there may be reason for concern over continued unrestricted importation of earthworms.  Regulatory activities have not been effective in reducing earthworm introductions in most areas of the world (Boag and Yeates 2001), probably because legal restrictions traditionally have not targeted earthworms or their propagules. There presently are no specific regulations concerning earthworm imports into the United States. Earthworm importations are regulated by APHIS under the Federal Plant Pest Act because of the potential for introduction of exotic plant pathogens in their guts and in soil that might accompany them (Tracy A. Horner, USDA APHIS, personal communication, 3 January 2002). The recent outbreak of foot-and-mouth disease in Europe has heightened concern about earthworm imports, because some species may be vectors for that viral pathogen and others (Edwards and Bohlen 1996, Jamieson 2000). APHIS is now considering guidelines specifically for the importation of earthworms into the United States. In this article, which is derived from a report prepared recently for APHIS, we review the status of earthworms in North America, address problems associated with exotic earthworm invasions, and discuss criteria for assessing potential risks of earthworm importation.","BioSciences","en",2002,"Sep","Georgia","USA","10.1641/0006-3568(2002)052[0801:eeiina]2.co;2","https://doi.org/10.1641/0006-3568(2002)052%5B0801:EEIINA%5D2.0.CO;2","10.1002/ecy.2936","North America","Various","N/A","ammonium; earthworm ecological group; element flux; exotic earthworms; nitrate; nitrification; nitrogen; nutrient cycling; pH; phosphorus; soil carbon; water content. "
"Earthworm-induced shifts in microbial diversity in soils with rare versus established invasive earthworm populations.","Alexandre B de Menezes","Peter H Thrall","p class=""chapter-para""European earthworms have colonised many parts of Australia, although their impact on soil microbial communities remains largely uncharacterised. An experiment was conducted to contrast the responses to emAporrectodea trapezoides introduction between soils from sites with established (Talmo, 64 emA. trapezoides m−2) and rare (Glenrock, 0.6 emA. trapezoides m−2) emA. trapezoides populations. Our hypothesis was that earthworm introduction would lead to similar changes in bacterial communities in both soils. The effects of earthworm introduction (earthworm activity and cadaver decomposition) did not lead to a convergence of bacterial community composition between the two soils. However, in both soils, the Firmicutes decreased in abundance and a common set of bacteria responded positively to earthworms. The increase in the abundance of emFlavobacterium, Chitinophagaceae, Rhodocyclaceae and Sphingobacteriales were consistent with previous studies. Evidence for possible soil resistance to earthworms was observed, with lower earthworm survival in Glenrock microcosms coinciding with emA. trapezoides rarity in this site, lower soil organic matter and clay content and differences in the diversity and abundance of potential earthworm mutualist bacteria. These results suggest that while the impacts of earthworms vary between different soils, the consistent response of some bacteria may aid in predicting the impacts of earthworms on soil ecosystems./p","FEMS Microbiology Ecology","en",2018,"Mar","Australia","Australia","10.1093/femsec/fiy051","https://doi.org/10.1093/femsec/fiy051 ","10.1002/ecy.2936","Australia","Talmo","16S rRNA sequencing;pasture soils;soil nitrogen;invasive earthworms;soil microbiome;soil ecology","ammonium; earthworm ecological group; element flux; exotic earthworms; nitrate; nitrification; nitrogen; nutrient cycling; pH; phosphorus; soil carbon; water content. "
"The influence of invasive earthworms on indigenous fauna in ecosystems previously uninhabited by earthworms.","Sonja Migge-Kleian","Liam Heneghan","Recent studies on earthworm invasion of North American soils report dramatic changes in soil structure, nutrient dynamics and plant communities in ecosystems historically free of earthworms. However, the direct and indirect impacts of earthworm invasions on animals have been largely ignored. This paper summarizes the current knowledge on the impact of earthworm invasion on other soil fauna, vertebrates as well as invertebrates.  Earthworm invasions can have positive effects on the abundance of other soil invertebrates, but such effects are often small, transient, and restricted to habitats with harsh climates or a long history of earthworm co-occurrence with other soil invertebrates. Middens and burrows can increase soil heterogeneity and create microhabitats with a larger pore size, high microbial biomass, and microclimates that are attractive to micro- and mesofauna. Under harsh climatic conditions, the aggregates formed by earthworms may increase the stability of soil microclimates. Positive effects can also be seen when comminution and mucus secretion increase the palatability of unpalatable organic material for microorganisms which are the main food of most micro- and mesofaunal groups. For larger invertebrates or small vertebrates, invasive earthworms may become important prey, with the potential to increase resource availability.  In the longer-term, the activity of invading earthworms can have a strong negative impact on indigenous faunal groups across multiple trophic levels. Evidence from field and laboratory studies indicates that the restructuring of soil layers, particularly the loss of organic horizons, physical disturbance to the soil, alteration of understory vegetation, and direct competition for food resources, lead directly and indirectly to significant declines in the abundance of soil micro- and mesofauna. Though studies of invasive earthworm impacts on the abundance of larger invertebrates or vertebrates are generally lacking, recent evidence suggests that reduced abundance of small soil fauna and alteration of soil microclimates may be contributing to declines in vertebrate fauna such as terrestrial salamanders. Preliminary evidence also suggests the potential for earthworm invasions to interact with other factors such as soil pollution, to negatively affect vertebrate populations.","Biological Invasions Belowground: Earthworms as Invasive Species (book)","en",2006,"Jan","Germany","USA","10.1007/978-1-4020-5429-7_8","http://dx.doi.org/10.1007/978-1-4020-5429-7_8","10.1002/ecy.2936","North America","N/A","Biological invasion;Collembola;Disturbance;Earthworm invasion;Oribatida;Review;Soil fauna;Salamander","ammonium; earthworm ecological group; element flux; exotic earthworms; nitrate; nitrification; nitrogen; nutrient cycling; pH; phosphorus; soil carbon; water content. "
"Belowground interactions with aboveground consequences: Invasive earthworms and arbuscular mycorrhizal fungi.","Shishir Paudel","Scott R. Loss","A mounting body of research suggests that invasive nonnative earthworms substantially alter microbial communities, including arbuscular mycorrhizal fungi (AMF). These changes to AMF can cascade to affect plant communities and vertebrate populations. Despite these research advances, relatively little is known about (1) the mechanisms behind earthworms’ effects on AMF and (2) the factors that determine the outcomes of earthworm–AMF interactions (i.e., whether AMF abundance is increased or decreased and subsequent effects on plants). We predict that AMF-mediated effects of nonnative earthworms on ecosystems are nearly universal because (1) AMF are important components of most terrestrial ecosystems, (2) nonnative earthworms have become established in nearly every type of terrestrial ecosystem, and (3) nonnative earthworms, due to their burrowing and feeding behavior, greatly affect AMF with potentially profound concomitant effects on plant communities. We highlight the multiple direct and indirect effects of nonnative earthworms on plants and review what is currently known about the interaction between earthworms and AMF. We also illustrate how the effects of nonnative earthworms on plant–AMF mutualisms can alter the structure and stability of aboveground plant communities, as well as the vertebrate communities relying on these habitats. Integrative studies that assess the interactive effects of earthworms and AMF can provide new insights into the role that belowground ecosystem engineers play in altering aboveground ecological processes. Understanding these processes may improve our ability to predict the structure of plant and animal communities in earthworm-invaded regions and to develop management strategies that limit the numerous undesired impacts of earthworms.","Ecology","en",2015,"Sep","USA","USA","10.1890/15-1085.1","https://doi.org/10.1890/15-1085","10.1002/ecy.2936","North America","N/A","arbuscular mycorrhizal fungi;disturbance;earthworm invasion;ecosystem engineers;plant community;plant–soil interactions  ","ammonium; earthworm ecological group; element flux; exotic earthworms; nitrate; nitrification; nitrogen; nutrient cycling; pH; phosphorus; soil carbon; water content. "
"Earthworm activity and soil structure changes due to organic enrichments in vineyard system.","G. Pérès","V. Hallaire"," The effect of organic enrichment on earthworm activity and soil structure was studied in two French vineyards, by comparing control and test plots. In each vineyard the organic matter quantitatively increased the abundance and biomass of the earthworm community. These increases were associated with a higher level of species diversity and a higher evenness corresponding to the development of endogeic community. These earthworm community changes were associated with an increase in granular bioturbated areas and in macroporosity in the top soil layer. The micromorphological approach incorporated an original process of image analysis which appeared to be an appropriate method for characterizing pore morphology in this study. The pores when characterized by their size and shape could be related to ecological groups and growth stages of earthworms.","Biology and fertility of soils","en",1998,"Sep","France","France","10.1007/s003740050452","http://dx.doi.org/10.1007/s003740050452","10.1002/ecy.2936","France ","Champagne, Mâcon, Montbré ","Organic matter  Earthworm activity  Soil structure  Micromorphology  Image analysis","ammonium; earthworm ecological group; element flux; exotic earthworms; nitrate; nitrification; nitrogen; nutrient cycling; pH; phosphorus; soil carbon; water content. "
"Performance of the trim and fill method in the presence of publication bias and between-study heterogeneity.","Jaime L. Peters","Lesley Rushton","The trim and fill method allows estimation of an adjusted meta‐analysis estimate in the presence of publication bias. To date, the performance of the trim and fill method has had little assessment. In this paper, we provide a more comprehensive examination of different versions of the trim and fill method in a number of simulated meta‐analysis scenarios, comparing results with those from usual unadjusted meta‐analysis models and two simple alternatives, namely use of the estimate from: (i) the largest; or (ii) the most precise study in the meta‐analysis. Findings suggest a great deal of variability in the performance of the different approaches. When there is large between‐study heterogeneity the trim and fill method can underestimate the true positive effect when there is nopublication bias. However, when publication bias is present the trim and fill method can give estimates that are less biased than the usual meta‐analysis models. Although results suggest that the use of the estimate from the largest or most precise study seems a reasonable approach in the presence of publication bias, when between‐study heterogeneity exists our simulations show that these estimates are quite biased. We conclude that in the presence of publication bias use of the trim and fill method can help to reduce the bias in pooled estimates, even though the performance of this method is not ideal. However, because we do not know whether funnel plot asymmetry is truly caused by publication bias, and because there is great variability in the performance of different trim and fill estimators and models in various meta‐analysis scenarios, we recommend use of the trim and fill method as a form of sensitivity analysis as intended by the authors of the method. Copyright © 2007 John Wiley &amp; Sons, Ltd.","Statistics  in Medecine","en",2007,"Sep","UK","UK","10.1002/sim.2889","http://dx.doi.org/10.1002/sim.2889","10.1002/ecy.2936","Metaanalysis","Various","Between-study heterogeneity;meta-analysis;publication bias;simulation;trim and fill  ","ammonium; earthworm ecological group; element flux; exotic earthworms; nitrate; nitrification; nitrogen; nutrient cycling; pH; phosphorus; soil carbon; water content. "
"Earthworm species composition affects the soil bacterial community and net nitrogen mineralization.","Maria B. Postma-Blaauw","Lijbert Brussaard","Knowledge of the effects of species diversity within taxonomic groups on nutrient cycling is important for understanding the role of soil biota in sustainable agriculture. We hypothesized that earthworm species specifically affect nitrogen mineralization, characteristically for their ecological group classifications, and that earthworm species interactions would affect mineralization through competition and facilitation effects. A mesocosm experiment was conducted to investigate the effect of three earthworm species, representative of different ecological groups (epigeic: emLumbricus rubellus; endogeic: emAporrectodea caliginosa tuberculata; and anecic: emLumbricus terrestris), and their interactions on the bacterial community, and on nitrogen mineralization from 15N-labelled crop residue and from soil organic matter./ppOur results indicate that emL. rubellus and emL. terrestris enhanced mineralization of the applied crop residue whereas emA. caliginosa had no effect. On the other hand, emL. rubellus and emA. caliginosa enhanced mineralization of the soil organic matter, whereas emL. terrestris had no effect. The interactions between different earthworm species affected the bacterial community and the net mineralization of soil organic matter. The two-species interactions between emL. rubellus and emA. caliginosa, and emL. rubellus and emL. terrestris, resulted in reduced mineral N concentrations derived from soil organic matter, probably through increased immobilization in the bacterial biomass. In contrast, the interaction between emA. caliginosa and emL. terrestris resulted in increased bacterial growth rate and reduced total soil C. When all three species were combined, the interaction between emA. caliginosa and emL. terrestris was dominant. We conclude that the effects of earthworms on nitrogen mineralization depend on the ecological traits of the earthworm species present, and can be modified by species interactions. Knowledge of these effects can be made useful in the prevention of nutrient losses and increased soil fertility in agricultural systems, that typically have a low earthworm diversity./p","Pedobiologia","en",2006,"Feb","The Netherlands","The Netherlands","10.1016/j.pedobi.2006201","https://doi.org/10.1016/j.pedobi.2006.02.001","10.1002/ecy.2936","The Netherlands","De Bovenbuurt","Soil Earthworms Biodiversity Species interactions Nutrients Functional group","ammonium; earthworm ecological group; element flux; exotic earthworms; nitrate; nitrification; nitrogen; nutrient cycling; pH; phosphorus; soil carbon; water content. "
